----------------------------------------------------------------------------
CrystalDiskInfo 9.5.0 (C) 2008-2024 hiyohiyo
                                Crystal Dew World: https://crystalmark.info/
----------------------------------------------------------------------------

    OS : Windows 11 Pro 24H2 [10.0 Build 26100] (x64)
  Date : 2025/03/13 17:34:25

-- Controller Map ----------------------------------------------------------
 + Standard SATA AHCI Controller [ATA]
   - ST2000DM008-2FR102
 - Standard SATA AHCI Controller [ATA]
 - Microsoft Storage Spaces Controller [SCSI]
 + Standard NVM Express Controller [SCSI]
   - Samsung SSD 970 EVO Plus 1TB
 + Asmedia 106x SATA Controller [SCSI]
   - ST2000DM008-2FR102

-- Disk List ---------------------------------------------------------------
 (01) Samsung SSD 970 EVO Plus 1TB : 1000.2 GB [1/2/0, sq] - nv
 (02) ST2000DM008-2FR102 : 2000.3 GB [0/1/0, pd1]
 (03) ST2000DM008-2FR102 : 2000.3 GB [2/3/0, pd1]

----------------------------------------------------------------------------
 (01) Samsung SSD 970 EVO Plus 1TB
----------------------------------------------------------------------------
           Model : Samsung SSD 970 EVO Plus 1TB
        Firmware : 2B2QEXM7
   Serial Number : S59ANM0W709130A
       Disk Size : 1000.2 GB
       Interface : NVM Express
        Standard : NVM Express 1.3
   Transfer Mode : PCIe 3.0 x4 | PCIe 3.0 x4
  Power On Hours : 8902 hours
  Power On Count : 209 count
      Host Reads : 35275 GB
     Host Writes : 50622 GB
     Temperature : 46 C (114 F)
   Health Status : Good (97 %)
        Features : S.M.A.R.T., TRIM, VolatileWriteCache
    Drive Letter : C:

-- S.M.A.R.T. --------------------------------------------------------------
ID RawValues(6) Attribute Name
01 000000000000 Critical Warning
02 00000000013F Composite Temperature
03 000000000064 Available Spare
04 00000000000A Available Spare Threshold
05 000000000003 Percentage Used
06 00000468CE3B Data Units Read
07 00000653EE12 Data Units Written
08 000035BB8028 Host Read Commands
09 00003CDE4617 Host Write Commands
0A 000000001722 Controller Busy Time
0B 0000000000D1 Power Cycles
0C 0000000022C6 Power On Hours
0D 000000000043 Unsafe Shutdowns
0E 000000000000 Media and Data Integrity Errors
0F 0000000009D6 Number of Error Information Log Entries

-- IDENTIFY_DEVICE ---------------------------------------------------------
        0    1    2    3    4    5    6    7    8    9
000: 144D 144D 3553 4139 4D4E 5730 3037 3139 3033 2041
010: 2020 2020 6153 736D 6E75 2067 5353 2044 3739 2030
020: 5645 204F 6C50 7375 3120 4254 2020 2020 2020 2020
030: 2020 2020 4232 5132 5845 374D 3802 0025 0900 0004
040: 0300 0001 0D40 0003 1200 007A 0000 0000 0000 0000
050: 0000 0000 0000 0000 0000 0000 0000 0000 0000 0000
060: 0000 0000 0000 0000 0000 0000 0000 0000 0000 0000
070: 0000 0000 0000 0000 0000 0000 0000 0000 0000 0000
080: 0000 0000 0000 0000 0000 0000 0000 0000 0000 0000
090: 0000 0000 0000 0000 0000 0000 0000 0000 0000 0000
100: 0000 0000 0000 0000 0000 0000 0000 0000 0000 0000
110: 0000 0000 0000 0000 0000 0000 0000 0000 0000 0000
120: 0000 0000 0000 0000 0000 0000 0000 0000 0017 0307
130: 0316 043F 0101 0166 0166 0000 0000 0000 0000 0000
140: 6000 E0DB 00E8 0000 0000 0000 0000 0000 0000 0000
150: 0000 0000 0000 0000 0000 0000 0000 0000 0023 0000
160: 0000 0001 0164 0166 0000 0000 0000 0000 0000 0000
170: 0000 0000 0000 0000 0000 0000 0000 0000 0000 0000
180: 0000 0000 0000 0000 0000 0000 0000 0000 0000 0000
190: 0000 0000 0000 0000 0000 0000 0000 0000 0000 0000
200: 0000 0000 0000 0000 0000 0000 0000 0000 0000 0000
210: 0000 0000 0000 0000 0000 0000 0000 0000 0000 0000
220: 0000 0000 0000 0000 0000 0000 0000 0000 0000 0000
230: 0000 0000 0000 0000 0000 0000 0000 0000 0000 0000
240: 0000 0000 0000 0000 0000 0000 0000 0000 0000 0000
250: 0000 0000 0000 0000 0000 0000

-- SMART_NVME --------------------------------------------------------------
     +0 +1 +2 +3 +4 +5 +6 +7 +8 +9 +A +B +C +D +E +F
000: 00 3F 01 64 0A 03 00 00 00 00 00 00 00 00 00 00
010: 00 00 00 00 00 00 00 00 00 00 00 00 00 00 00 00
020: 3B CE 68 04 00 00 00 00 00 00 00 00 00 00 00 00
030: 12 EE 53 06 00 00 00 00 00 00 00 00 00 00 00 00
040: 28 80 BB 35 00 00 00 00 00 00 00 00 00 00 00 00
050: 17 46 DE 3C 00 00 00 00 00 00 00 00 00 00 00 00
060: 22 17 00 00 00 00 00 00 00 00 00 00 00 00 00 00
070: D1 00 00 00 00 00 00 00 00 00 00 00 00 00 00 00
080: C6 22 00 00 00 00 00 00 00 00 00 00 00 00 00 00
090: 43 00 00 00 00 00 00 00 00 00 00 00 00 00 00 00
0A0: 00 00 00 00 00 00 00 00 00 00 00 00 00 00 00 00
0B0: D6 09 00 00 00 00 00 00 00 00 00 00 00 00 00 00
0C0: 00 00 00 00 00 00 00 00 3F 01 46 01 00 00 00 00
0D0: 00 00 00 00 00 00 00 00 00 00 00 00 00 00 00 00
0E0: 00 00 00 00 00 00 00 00 00 00 00 00 00 00 00 00
0F0: 00 00 00 00 00 00 00 00 00 00 00 00 00 00 00 00
100: 00 00 00 00 00 00 00 00 00 00 00 00 00 00 00 00
110: 00 00 00 00 00 00 00 00 00 00 00 00 00 00 00 00
120: 00 00 00 00 00 00 00 00 00 00 00 00 00 00 00 00
130: 00 00 00 00 00 00 00 00 00 00 00 00 00 00 00 00
140: 00 00 00 00 00 00 00 00 00 00 00 00 00 00 00 00
150: 00 00 00 00 00 00 00 00 00 00 00 00 00 00 00 00
160: 00 00 00 00 00 00 00 00 00 00 00 00 00 00 00 00
170: 00 00 00 00 00 00 00 00 00 00 00 00 00 00 00 00
180: 00 00 00 00 00 00 00 00 00 00 00 00 00 00 00 00
190: 00 00 00 00 00 00 00 00 00 00 00 00 00 00 00 00
1A0: 00 00 00 00 00 00 00 00 00 00 00 00 00 00 00 00
1B0: 00 00 00 00 00 00 00 00 00 00 00 00 00 00 00 00
1C0: 00 00 00 00 00 00 00 00 00 00 00 00 00 00 00 00
1D0: 00 00 00 00 00 00 00 00 00 00 00 00 00 00 00 00
1E0: 00 00 00 00 00 00 00 00 00 00 00 00 00 00 00 00
1F0: 00 00 00 00 00 00 00 00 00 00 00 00 00 00 00 00

----------------------------------------------------------------------------
 (02) ST2000DM008-2FR102
----------------------------------------------------------------------------
           Model : ST2000DM008-2FR102
        Firmware : 0001
   Serial Number : ZFL2AM2D
       Disk Size : 2000.3 GB (8.4/137.4/2000.3/2000.3)
     Buffer Size : Unknown
     Queue Depth : 32
    # of Sectors : 3907029168
   Rotation Rate : 7200 RPM
       Interface : Serial ATA
   Major Version : ACS-3
   Minor Version : ACS-3 Revision 5
   Transfer Mode : SATA/600 | SATA/600
  Power On Hours : 36477 hours
  Power On Count : 521 count
     Temperature : 37 C (98 F)
   Health Status : Good
        Features : S.M.A.R.T., APM, NCQ, TRIM, GPL
       APM Level : 8080h [ON]
       AAM Level : ----
    Drive Letter : E:

-- S.M.A.R.T. --------------------------------------------------------------
ID Cur Wor Thr RawValues(6) Attribute Name
01 _66 _64 __6 00000038FBCA Read Error Rate
03 _98 _98 __0 000000000000 Spin-Up Time
04 _86 _86 _20 000000003B11 Start/Stop Count
05 100 100 _10 000000000000 Reallocated Sectors Count
07 _85 _60 _45 000010E7B0CB Seek Error Rate
09 _59 _59 __0 1B5100008E7D Power-On Hours
0A 100 100 _97 000000000000 Spin Retry Count
0C 100 100 _20 000000000209 Power Cycle Count
B7 100 100 __0 000000000000 Vendor Specific
B8 100 100 _99 000000000000 End-to-End Error
BB 100 100 __0 000000000000 Reported Uncorrectable Errors
BC 100 100 __0 000000000000 Command Timeout
BD 100 100 __0 000000000000 High Fly Writes
BE _63 _46 _40 000027170025 Airflow Temperature
BF 100 100 __0 000000000000 G-Sense Error Rate
C0 100 100 __0 00000000003C Power-off Retract Count
C1 __1 __1 __0 0000000310C5 Load/Unload Cycle Count
C2 _37 _54 __0 000C00000025 Temperature
C3 _66 _64 __0 00000038FBCA Hardware ECC recovered
C5 100 100 __0 000000000000 Current Pending Sector Count
C6 100 100 __0 000000000000 Uncorrectable Sector Count
C7 200 200 __0 000000000000 UltraDMA CRC Error Count
F0 100 253 __0 AC860000176D Head Flying Hours
F1 100 253 __0 0016A1F8F9D9 Total Host Writes
F2 100 253 __0 00175E707579 Total Host Reads

-- IDENTIFY_DEVICE ---------------------------------------------------------
        0    1    2    3    4    5    6    7    8    9
000: 0C5A 3FFF C837 0010 0000 0000 003F 0000 0000 0000
010: 2020 2020 2020 2020 2020 2020 5A46 4C32 414D 3244
020: 0000 0000 0000 3030 3031 2020 2020 5354 3230 3030
030: 444D 3030 382D 3246 5231 3032 2020 2020 2020 2020
040: 2020 2020 2020 2020 2020 2020 2020 8010 4000 2F00
050: 4000 0200 0200 0007 3FFF 0010 003F FC10 00FB 0110
060: FFFF 0FFF 0000 0007 0003 0078 0078 0078 0078 0100
070: 0000 0000 0000 0000 0000 001F 870E 0006 00CC 0040
080: 07F0 006D 346B 7569 4163 3469 B449 4163 407F 0067
090: 0067 8080 FFFE 0000 D0D0 0000 0000 0000 0000 0000
100: 88B0 E8E0 0000 0000 0000 0008 6003 0000 5000 C500
110: C625 0C98 0000 0000 0000 0000 0000 0000 0000 405E
120: 401C 0000 0000 0000 0000 0000 0000 0000 0029 0000
130: 0000 0000 0000 0000 0000 0000 0000 5000 0000 0000
140: 0000 0000 0000 0000 0000 0000 BDFF 0000 0000 0000
150: 0008 0000 BDFF 0827 0000 8000 0000 0184 AD00 8000
160: 0000 0000 0000 0000 0000 0000 0000 0000 0002 0001
170: 0000 0000 0000 0000 0000 0000 0000 0000 0000 0000
180: 0000 0000 0000 0000 0000 0000 0000 0000 0000 0000
190: 0000 0000 0000 0000 0000 0000 0000 0000 0000 0000
200: 0000 0000 0000 0000 0000 0000 30A5 0000 0000 4000
210: 0000 0000 0000 0000 0000 0000 0000 1C20 0000 0000
220: 0000 0000 107F 0000 0000 0000 0000 0000 0000 0000
230: 0000 0000 0000 0000 0000 0000 0000 0000 0000 0000
240: 0000 0000 0000 0000 0000 0000 0000 0000 0000 0000
250: 0000 0000 0000 0000 0000 CBA5

-- SMART_READ_DATA ---------------------------------------------------------
     +0 +1 +2 +3 +4 +5 +6 +7 +8 +9 +A +B +C +D +E +F
000: 0A 00 01 0F 00 42 40 CA FB 38 00 00 00 00 03 03
010: 00 62 62 00 00 00 00 00 00 00 04 32 00 56 56 11
020: 3B 00 00 00 00 00 05 33 00 64 64 00 00 00 00 00
030: 00 00 07 0F 00 55 3C CB B0 E7 10 00 00 00 09 32
040: 00 3B 3B 7D 8E 00 00 51 1B 00 0A 13 00 64 64 00
050: 00 00 00 00 00 00 0C 32 00 64 64 09 02 00 00 00
060: 00 00 B7 32 00 64 64 00 00 00 00 00 00 00 B8 32
070: 00 64 64 00 00 00 00 00 00 00 BB 32 00 64 64 00
080: 00 00 00 00 00 00 BC 32 00 64 64 00 00 00 00 00
090: 00 00 BD 3A 00 64 64 00 00 00 00 00 00 00 BE 22
0A0: 00 3F 2E 25 00 17 27 00 00 00 BF 32 00 64 64 00
0B0: 00 00 00 00 00 00 C0 32 00 64 64 3C 00 00 00 00
0C0: 00 00 C1 32 00 01 01 C5 10 03 00 00 00 00 C2 22
0D0: 00 25 36 25 00 00 00 0C 00 00 C3 1A 00 42 40 CA
0E0: FB 38 00 00 00 00 C5 12 00 64 64 00 00 00 00 00
0F0: 00 00 C6 10 00 64 64 00 00 00 00 00 00 00 C7 3E
100: 00 C8 C8 00 00 00 00 00 00 00 F0 00 00 64 FD 6D
110: 17 00 00 86 AC 2F F1 00 00 64 FD D9 F9 F8 A1 16
120: 00 00 F2 00 00 64 FD 79 75 70 5E 17 00 00 00 00
130: 00 00 00 00 00 00 00 00 00 00 00 00 00 00 00 00
140: 00 00 00 00 00 00 00 00 00 00 00 00 00 00 00 00
150: 00 00 00 00 00 00 00 00 00 00 00 00 00 00 00 00
160: 00 00 00 00 00 00 00 00 00 00 00 00 00 00 00 73
170: 03 00 01 00 01 CD 02 00 00 00 00 00 00 00 00 00
180: 00 00 00 00 00 00 00 00 01 02 02 02 02 02 02 02
190: 02 00 00 00 00 00 00 00 00 01 00 00 00 00 00 00
1A0: 00 00 00 00 00 00 00 00 35 D9 A0 B2 6E 77 00 00
1B0: 00 00 00 00 01 00 A7 4B D9 F9 F8 A1 16 00 00 00
1C0: 79 75 70 5E 17 00 00 00 00 00 00 00 00 00 00 00
1D0: 01 00 00 00 00 00 00 00 5F 00 00 00 01 00 00 00
1E0: 00 00 00 00 12 27 00 00 00 00 00 00 00 00 03 02
1F0: 01 00 00 00 00 00 00 00 00 00 03 19 00 00 00 11

-- SMART_READ_THRESHOLD ----------------------------------------------------
     +0 +1 +2 +3 +4 +5 +6 +7 +8 +9 +A +B +C +D +E +F
000: 01 00 01 06 00 00 00 00 00 00 00 00 00 00 03 00
010: 00 00 00 00 00 00 00 00 00 00 04 14 00 00 00 00
020: 00 00 00 00 00 00 05 0A 00 00 00 00 00 00 00 00
030: 00 00 07 2D 00 00 00 00 00 00 00 00 00 00 09 00
040: 00 00 00 00 00 00 00 00 00 00 0A 61 00 00 00 00
050: 00 00 00 00 00 00 0C 14 00 00 00 00 00 00 00 00
060: 00 00 B7 00 00 00 00 00 00 00 00 00 00 00 B8 63
070: 00 00 00 00 00 00 00 00 00 00 BB 00 00 00 00 00
080: 00 00 00 00 00 00 BC 00 00 00 00 00 00 00 00 00
090: 00 00 BD 00 00 00 00 00 00 00 00 00 00 00 BE 28
0A0: 00 00 00 00 00 00 00 00 00 00 BF 00 00 00 00 00
0B0: 00 00 00 00 00 00 C0 00 00 00 00 00 00 00 00 00
0C0: 00 00 C1 00 00 00 00 00 00 00 00 00 00 00 C2 00
0D0: 00 00 00 00 00 00 00 00 00 00 C3 00 00 00 00 00
0E0: 00 00 00 00 00 00 C5 00 00 00 00 00 00 00 00 00
0F0: 00 00 C6 00 00 00 00 00 00 00 00 00 00 00 C7 00
100: 00 00 00 00 00 00 00 00 00 00 F0 00 00 00 00 00
110: 00 00 00 00 00 00 F1 00 00 00 00 00 00 00 00 00
120: 00 00 F2 00 00 00 00 00 00 00 00 00 00 00 00 00
130: 00 00 00 00 00 00 00 00 00 00 00 00 00 00 00 00
140: 00 00 00 00 00 00 00 00 00 00 00 00 00 00 00 00
150: 00 00 00 00 00 00 00 00 00 00 00 00 00 00 00 00
160: 00 00 00 00 00 00 00 00 00 00 00 00 00 00 00 00
170: 00 00 00 00 00 00 00 00 00 00 00 00 00 00 00 00
180: 00 00 00 00 00 00 00 00 00 00 00 00 00 00 00 00
190: 00 00 00 00 00 00 00 00 00 00 00 00 00 00 00 00
1A0: 00 00 00 00 00 00 00 00 00 00 00 00 00 00 00 00
1B0: 00 00 00 00 00 00 00 00 00 00 00 00 00 00 00 00
1C0: 00 00 00 00 00 00 00 00 00 00 00 00 00 00 00 00
1D0: 00 00 00 00 00 00 00 00 00 00 00 00 00 00 00 00
1E0: 00 00 00 00 00 00 00 00 00 00 00 00 00 00 00 00
1F0: 00 00 00 00 00 00 00 00 00 00 00 00 00 00 00 30

----------------------------------------------------------------------------
 (03) ST2000DM008-2FR102
----------------------------------------------------------------------------
           Model : ST2000DM008-2FR102
        Firmware : 0001
   Serial Number : ZFL16MMW
       Disk Size : 2000.3 GB (8.4/137.4/2000.3/2000.3)
     Buffer Size : Unknown
     Queue Depth : 32
    # of Sectors : 3907029168
   Rotation Rate : 7200 RPM
       Interface : Serial ATA
   Major Version : ACS-3
   Minor Version : ACS-3 Revision 5
   Transfer Mode : SATA/600 | SATA/600
  Power On Hours : 40740 hours
  Power On Count : 585 count
     Temperature : 41 C (105 F)
   Health Status : Good
        Features : S.M.A.R.T., APM, NCQ, TRIM, GPL
       APM Level : 8080h [ON]
       AAM Level : ----
    Drive Letter : E:

-- S.M.A.R.T. --------------------------------------------------------------
ID Cur Wor Thr RawValues(6) Attribute Name
01 _77 _64 __6 000002E159DD Read Error Rate
03 _98 _98 __0 000000000000 Spin-Up Time
04 _98 _98 _20 000000000BF5 Start/Stop Count
05 100 100 _10 000000000000 Reallocated Sectors Count
07 _87 _60 _45 00001C5FEF16 Seek Error Rate
09 _54 _54 __0 B79500009F24 Power-On Hours
0A 100 100 _97 000000000000 Spin Retry Count
0C 100 100 _20 000000000249 Power Cycle Count
B7 100 100 __0 000000000000 Vendor Specific
B8 100 100 _99 000000000000 End-to-End Error
BB 100 100 __0 000000000000 Reported Uncorrectable Errors
BC 100 100 __0 000000000000 Command Timeout
BD 100 100 __0 000000000000 High Fly Writes
BE _59 _43 _40 000029170029 Airflow Temperature
BF 100 100 __0 000000000000 G-Sense Error Rate
C0 100 100 __0 00000000006F Power-off Retract Count
C1 __1 __1 __0 0000000413E3 Load/Unload Cycle Count
C2 _41 _57 __0 000B00000029 Temperature
C3 _77 _64 __0 000002E159DD Hardware ECC recovered
C5 100 100 __0 000000000000 Current Pending Sector Count
C6 100 100 __0 000000000000 Uncorrectable Sector Count
C7 200 200 __0 000000000000 UltraDMA CRC Error Count
F0 100 253 __0 09A900004773 Head Flying Hours
F1 100 253 __0 0014CE2A4383 Total Host Writes
F2 100 253 __0 0012EDB610B3 Total Host Reads

-- IDENTIFY_DEVICE ---------------------------------------------------------
        0    1    2    3    4    5    6    7    8    9
000: 0C5A 3FFF C837 0010 0000 0000 003F 0000 0000 0000
010: 2020 2020 2020 2020 2020 2020 5A46 4C31 364D 4D57
020: 0000 0000 0000 3030 3031 2020 2020 5354 3230 3030
030: 444D 3030 382D 3246 5231 3032 2020 2020 2020 2020
040: 2020 2020 2020 2020 2020 2020 2020 8010 4000 2F00
050: 4000 0200 0200 0007 3FFF 0010 003F FC10 00FB 0110
060: FFFF 0FFF 0000 0007 0003 0078 0078 0078 0078 0100
070: 0000 0000 0000 0000 0000 001F 870E 0006 00CC 0040
080: 07F0 006D 346B 7569 4163 3469 B449 4163 207F 0063
090: 0063 8080 FFFE 0000 D0D0 0000 0000 0000 0000 0000
100: 88B0 E8E0 0000 0000 0000 0008 6003 0000 5000 C500
110: C355 3A61 0000 0000 0000 0000 0000 0000 0000 405E
120: 401C 0000 0000 0000 0000 0000 0000 0000 0029 0000
130: 0000 0000 0000 0000 0000 0000 0000 5000 0000 0000
140: 0000 0000 0000 0000 0000 0000 BDFF 0000 0000 0000
150: 0008 0000 BDFF 0827 0000 8000 0000 0184 AD00 8000
160: 0000 0000 0000 0000 0000 0000 0000 0000 0002 0001
170: 0000 0000 0000 0000 0000 0000 0000 0000 0000 0000
180: 0000 0000 0000 0000 0000 0000 0000 0000 0000 0000
190: 0000 0000 0000 0000 0000 0000 0000 0000 0000 0000
200: 0000 0000 0000 0000 0000 0000 30A5 0000 0000 4000
210: 0000 0000 0000 0000 0000 0000 0000 1C20 0000 0000
220: 0000 0000 107F 0000 0000 0000 0000 0000 0000 0000
230: 0000 0000 0000 0000 0000 0000 0000 0000 0000 0000
240: 0000 0000 0000 0000 0000 0000 0000 0000 0000 0000
250: 0000 0000 0000 0000 0000 ADA5

-- SMART_READ_DATA ---------------------------------------------------------
     +0 +1 +2 +3 +4 +5 +6 +7 +8 +9 +A +B +C +D +E +F
000: 0A 00 01 0F 00 4D 40 DD 59 E1 02 00 00 00 03 03
010: 00 62 62 00 00 00 00 00 00 00 04 32 00 62 62 F5
020: 0B 00 00 00 00 00 05 33 00 64 64 00 00 00 00 00
030: 00 00 07 0F 00 57 3C 16 EF 5F 1C 00 00 00 09 32
040: 00 36 36 24 9F 00 00 95 B7 0A 0A 13 00 64 64 00
050: 00 00 00 00 00 00 0C 32 00 64 64 49 02 00 00 00
060: 00 00 B7 32 00 64 64 00 00 00 00 00 00 00 B8 32
070: 00 64 64 00 00 00 00 00 00 00 BB 32 00 64 64 00
080: 00 00 00 00 00 00 BC 32 00 64 64 00 00 00 00 00
090: 00 00 BD 3A 00 64 64 00 00 00 00 00 00 00 BE 22
0A0: 00 3B 2B 29 00 17 29 00 00 00 BF 32 00 64 64 00
0B0: 00 00 00 00 00 00 C0 32 00 64 64 6F 00 00 00 00
0C0: 00 00 C1 32 00 01 01 E3 13 04 00 00 00 00 C2 22
0D0: 00 29 39 29 00 00 00 0B 00 00 C3 1A 00 4D 40 DD
0E0: 59 E1 02 00 00 00 C5 12 00 64 64 00 00 00 00 00
0F0: 00 00 C6 10 00 64 64 00 00 00 00 00 00 00 C7 3E
100: 00 C8 C8 00 00 00 00 00 00 00 F0 00 00 64 FD 73
110: 47 00 00 A9 09 33 F1 00 00 64 FD 83 43 2A CE 14
120: 00 00 F2 00 00 64 FD B3 10 B6 ED 12 00 00 00 00
130: 00 00 00 00 00 00 00 00 00 00 00 00 00 00 00 00
140: 00 00 00 00 00 00 00 00 00 00 00 00 00 00 00 00
150: 00 00 00 00 00 00 00 00 00 00 00 00 00 00 00 00
160: 00 00 00 00 00 00 00 00 00 00 00 00 00 00 00 73
170: 03 00 01 00 01 C6 02 00 00 00 00 00 00 00 00 00
180: 00 00 00 00 9F 02 00 00 05 02 02 02 02 02 02 02
190: 02 00 00 00 00 00 00 00 00 01 00 00 00 00 00 00
1A0: 00 00 00 00 00 00 00 00 60 3F A3 10 64 85 00 00
1B0: 00 00 00 00 01 00 3B 7F 83 43 2A CE 14 00 00 00
1C0: B3 10 B6 ED 12 00 00 00 00 00 00 00 00 00 00 00
1D0: 01 00 00 00 00 00 00 00 2C 13 00 00 01 00 00 00
1E0: 00 00 00 00 1D 4A 00 00 00 00 00 00 00 00 03 02
1F0: 02 00 00 00 00 00 00 00 00 00 03 19 00 00 00 A0

-- SMART_READ_THRESHOLD ----------------------------------------------------
     +0 +1 +2 +3 +4 +5 +6 +7 +8 +9 +A +B +C +D +E +F
000: 01 00 01 06 00 00 00 00 00 00 00 00 00 00 03 00
010: 00 00 00 00 00 00 00 00 00 00 04 14 00 00 00 00
020: 00 00 00 00 00 00 05 0A 00 00 00 00 00 00 00 00
030: 00 00 07 2D 00 00 00 00 00 00 00 00 00 00 09 00
040: 00 00 00 00 00 00 00 00 00 00 0A 61 00 00 00 00
050: 00 00 00 00 00 00 0C 14 00 00 00 00 00 00 00 00
060: 00 00 B7 00 00 00 00 00 00 00 00 00 00 00 B8 63
070: 00 00 00 00 00 00 00 00 00 00 BB 00 00 00 00 00
080: 00 00 00 00 00 00 BC 00 00 00 00 00 00 00 00 00
090: 00 00 BD 00 00 00 00 00 00 00 00 00 00 00 BE 28
0A0: 00 00 00 00 00 00 00 00 00 00 BF 00 00 00 00 00
0B0: 00 00 00 00 00 00 C0 00 00 00 00 00 00 00 00 00
0C0: 00 00 C1 00 00 00 00 00 00 00 00 00 00 00 C2 00
0D0: 00 00 00 00 00 00 00 00 00 00 C3 00 00 00 00 00
0E0: 00 00 00 00 00 00 C5 00 00 00 00 00 00 00 00 00
0F0: 00 00 C6 00 00 00 00 00 00 00 00 00 00 00 C7 00
100: 00 00 00 00 00 00 00 00 00 00 F0 00 00 00 00 00
110: 00 00 00 00 00 00 F1 00 00 00 00 00 00 00 00 00
120: 00 00 F2 00 00 00 00 00 00 00 00 00 00 00 00 00
130: 00 00 00 00 00 00 00 00 00 00 00 00 00 00 00 00
140: 00 00 00 00 00 00 00 00 00 00 00 00 00 00 00 00
150: 00 00 00 00 00 00 00 00 00 00 00 00 00 00 00 00
160: 00 00 00 00 00 00 00 00 00 00 00 00 00 00 00 00
170: 00 00 00 00 00 00 00 00 00 00 00 00 00 00 00 00
180: 00 00 00 00 00 00 00 00 00 00 00 00 00 00 00 00
190: 00 00 00 00 00 00 00 00 00 00 00 00 00 00 00 00
1A0: 00 00 00 00 00 00 00 00 00 00 00 00 00 00 00 00
1B0: 00 00 00 00 00 00 00 00 00 00 00 00 00 00 00 00
1C0: 00 00 00 00 00 00 00 00 00 00 00 00 00 00 00 00
1D0: 00 00 00 00 00 00 00 00 00 00 00 00 00 00 00 00
1E0: 00 00 00 00 00 00 00 00 00 00 00 00 00 00 00 00
1F0: 00 00 00 00 00 00 00 00 00 00 00 00 00 00 00 30

